{
  "build": {
    "base_image_digest": "sha256:1111111111111111111111111111111111111111111111111111111111111111",
    "containerfile_sha256": "2222222222222222222222222222222222222222222222222222222222222222",
    "context_root": ".",
    "direct_dependencies": {
      "cryptography": "48.0.0",
      "jsonschema": "4.26.0",
      "psycopg[binary]": "3.2.3",
      "referencing": "0.37.0"
    },
    "platform": "linux/amd64"
  },
  "capture_kind": "unsigned_external_oci_layout_capture_v1",
  "captured_at": "2026-07-25T00:00:00Z",
  "build_provenance_verified": false,
  "registry_provenance_verified": false,
  "image": {
    "bundle_files": {
      "/opt/c-fast-t1/docs/schemas/commodity-c-fast-l1-l5-audit-manifest-v2.schema.json": "3333333333333333333333333333333333333333333333333333333333333333",
      "/opt/c-fast-t1/docs/schemas/commodity-c-fast-l1-l5-audit-v1.schema.json": "3333333333333333333333333333333333333333333333333333333333333333",
      "/opt/c-fast-t1/docs/schemas/commodity-c-fast-l1-l5-audit-v2.schema.json": "3333333333333333333333333333333333333333333333333333333333333333",
      "/opt/c-fast-t1/docs/schemas/commodity-c-fast-questdb-readonly-proof-v1.schema.json": "3333333333333333333333333333333333333333333333333333333333333333",
      "/opt/c-fast-t1/docs/schemas/commodity-c-fast-t1-consume-v1.schema.json": "3333333333333333333333333333333333333333333333333333333333333333",
      "/opt/c-fast-t1/docs/schemas/commodity-c-fast-t1-one-shot-release-v1.schema.json": "3333333333333333333333333333333333333333333333333333333333333333",
      "/opt/c-fast-t1/docs/schemas/commodity-c-fast-t1-terminal-seal-v1.schema.json": "3333333333333333333333333333333333333333333333333333333333333333",
      "/opt/c-fast-t1/scripts/commodity_c_fast_l1_l5_audit.py": "3333333333333333333333333333333333333333333333333333333333333333",
      "/opt/c-fast-t1/scripts/commodity_c_fast_t1_one_shot.py": "3333333333333333333333333333333333333333333333333333333333333333"
    },
    "config": {
      "entrypoint": [
        "/usr/local/bin/python3.12",
        "-I",
        "/opt/c-fast-t1/scripts/commodity_c_fast_t1_one_shot.py"
      ],
      "labels": {
        "io.vnpy-web-bridge.c-fast-t1.authority-granted": "false",
        "io.vnpy-web-bridge.c-fast-t1.one-shot-runtime": "true",
        "org.opencontainers.image.revision": "0000000000000000000000000000000000000000",
        "org.opencontainers.image.title": "vnpy-web-bridge C_FAST T1 one-shot runner"
      },
      "relevant_environment": {
        "PATH": "/usr/local/bin:/usr/local/sbin:/usr/sbin:/usr/bin:/sbin:/bin",
        "LANG": "C.UTF-8",
        "GPG_KEY": "7169605F62C751356D054A26A821E680E5FA6305",
        "PYTHON_VERSION": "3.12.13",
        "PYTHON_SHA256": "c08bc65a81971c1dd5783182826503369466c7e67374d1646519adf05207b684",
        "PYTHONDONTWRITEBYTECODE": "1",
        "PYTHONUNBUFFERED": "1"
      },
      "user": "65532:65532",
      "working_dir": "/opt/c-fast-t1"
    },
    "digest": "sha256:4444444444444444444444444444444444444444444444444444444444444444",
    "export_sha256": "5555555555555555555555555555555555555555555555555555555555555555",
    "forbidden_path_matches": [],
    "id": "sha256:6666666666666666666666666666666666666666666666666666666666666666",
    "reference": "registry.invalid/vnpy-web-bridge-c-fast-t1@sha256:4444444444444444444444444444444444444444444444444444444444444444",
    "rootfs_layer_digests": [
      "sha256:7777777777777777777777777777777777777777777777777777777777777777"
    ],
    "signer_or_private_key_paths": [],
    "unexpected_bundle_paths": []
  },
  "producer": {
    "tool": "REPLACE_WITH_INSPECTOR",
    "tool_version": "REPLACE_WITH_VERSION"
  },
  "schema_version": "commodity_c_fast_t1_external_image_evidence_v1",
  "source_archive_sha256": "8888888888888888888888888888888888888888888888888888888888888888",
  "source_commit_sha": "0000000000000000000000000000000000000000"
}
